"Component","Qty","Purpose / Description","Price (USD)","Link / Distributor"
"Custom PCB Manufacture","5","The actual circuit board to solder everything on. Ordered via JLCPCB standard 2-layer service.","~$4.74","https://jlcpcb.com"
"Seeed Studio XIAO RP2040","1","Main microcontroller / brain for the macropad. Small footprint, plenty of GPIOs.","~$7.88","https://a.aliexpress.com/_EyHIJs2"
"0.96 I2C OLED Display","1","Screen to show active macro profiles and current modes.","~$2.00","https://a.aliexpress.com/_EGSrJ7g"
"Cherry MX Switches (10-pack)","1","Mechanical switches for the macro buttons.","~$6.08","https://a.aliexpress.com/_EuLENRY"
"1U Blank Keycaps (10-pack)","1","Standard covers for the mechanical switches.","~$3.35","https://a.aliexpress.com/_Eyx6JJo"
"5mm Green LEDs","3","Status LEDs for debugging (Bought locally, link is equivalent).","~$0.50","https://www.sparkfun.com/products/9592"
"330 Ohm Resistors","3","Current limiting resistors for the LEDs (Bought locally).","~$0.50","https://www.sparkfun.com/products/11507"
"4.7k Ohm Resistors","2","I2C pull-up resistors for stable OLED communication.","~$0.50","https://www.sparkfun.com/products/11508"
